{
  "anchor_atoms": [
    2,
    14,
    25,
    29
  ],
  "complex_id": "1hsg",
  "dataset_id": "rgroup_smoke",
  "dataset_version": "v1",
  "descriptors": {
    "heavy_atom_molecular_weight": 566.4270000000002,
    "logp": 2.8639000000000046,
    "molecular_weight": 635.979,
    "num_atoms": 45,
    "num_heavy_atoms": 45,
    "qed": 0.15322246044088367,
    "rotatable_bonds": 13,
    "tpsa": 123.49000000000001
  },
  "editable_atoms": [
    3,
    4,
    5,
    6,
    7,
    8,
    9,
    15,
    26,
    30
  ],
  "editable_smiles": null,
  "entry_path": "data/datasets/rgroup_smoke/entries/1hsg/entry.json",
  "has_conformer": true,
  "ligand_path": "data/datasets/rgroup_smoke/raw/1hsg/1hsg_ligand.pdb",
  "ligand_smiles": "CC(C)(C)NC(O)[C@@H]1CN(CC2CCCNC2)CCN1C[C@@H](O)C[C@@H](CC1CCCCC1)[C@H](O)N[C@H]1C2CCCCC2C[C@H]1O",
  "protein_path": "data/datasets/rgroup_smoke/raw/1hsg/1hsg_protein_clean.pdb",
  "provenance": {
    "entry_collection_path": "data/datasets/rgroup_smoke/entries/index.jsonl",
    "layout_version": "dataset_entries_v1",
    "migration": {
      "date": "2026-06-04",
      "note": "Moved canonical dataset records from top-level processed JSONL into dataset-scoped entries/index.jsonl and per-sample entry.json files.",
      "type": "data_layout_migration"
    }
  },
  "sample_id": "1hsg",
  "sample_quality": {
    "evaluable_for_repair": true,
    "exclusion_reasons": [],
    "min_protein_ligand_distance": 2.6264474104767457,
    "protein_ligand_clash_count": 0,
    "protein_ligand_overlap": false
  },
  "scaffold_atoms": [
    0,
    1,
    2,
    10,
    11,
    12,
    13,
    14,
    16,
    17,
    18,
    19,
    20,
    21,
    22,
    23,
    24,
    25,
    27,
    28,
    29,
    31,
    32,
    33,
    34,
    35,
    36,
    37,
    38,
    39,
    40,
    41,
    42,
    43,
    44
  ],
  "scaffold_smiles": "C1CCC(C[C@H](CCCN2CCN(CC3CCCNC3)CC2)CN[C@@H]2CCC3CCCCC32)CC1",
  "schema_path": "schemas/data/datasets/entries/dataset_entry_v0_1.json",
  "schema_version": "dataset_entry_v0_1",
  "status": "rdkit_ok"
}
