{
  "anchor_atoms": [
    2,
    9,
    15
  ],
  "complex_id": "1m17",
  "dataset_id": "rgroup_smoke_plus",
  "dataset_version": "v1",
  "descriptors": {
    "heavy_atom_molecular_weight": 370.2590000000001,
    "logp": 1.8630000000000022,
    "molecular_weight": 413.60300000000024,
    "num_atoms": 29,
    "num_heavy_atoms": 29,
    "qed": 0.4466515651030422,
    "rotatable_bonds": 11,
    "tpsa": 73.01
  },
  "editable_atoms": [
    0,
    1,
    10,
    11,
    12,
    13,
    14,
    16,
    17,
    18,
    19,
    20
  ],
  "editable_smiles": null,
  "entry_path": "data/datasets/rgroup_smoke_plus/entries/1m17/entry.json",
  "has_conformer": true,
  "ligand_path": "data/datasets/rgroup_smoke_plus/raw/1m17/1m17_ligand.pdb",
  "ligand_smiles": "CCC1CCCC(NC2NCNC3CC(OCCOC)C(OCCOC)CC32)C1",
  "protein_path": "data/datasets/rgroup_smoke_plus/raw/1m17/1m17_protein_clean.pdb",
  "provenance": {
    "entry_collection_path": "data/datasets/rgroup_smoke_plus/entries/index.jsonl",
    "layout_version": "dataset_entries_v1",
    "migration": {
      "date": "2026-06-04",
      "note": "Moved canonical dataset records from top-level processed JSONL into dataset-scoped entries/index.jsonl and per-sample entry.json files.",
      "type": "data_layout_migration"
    }
  },
  "sample_id": "1m17",
  "sample_quality": {
    "evaluable_for_repair": true,
    "exclusion_reasons": [],
    "min_protein_ligand_distance": 2.699139677749187,
    "protein_ligand_clash_count": 0,
    "protein_ligand_overlap": false
  },
  "scaffold_atoms": [
    2,
    3,
    4,
    5,
    6,
    7,
    8,
    9,
    15,
    21,
    22,
    23,
    24,
    25,
    26,
    27,
    28
  ],
  "scaffold_smiles": "C1CCC(NC2NCNC3CCCCC32)CC1",
  "schema_path": "schemas/data/datasets/entries/dataset_entry_v0_1.json",
  "schema_version": "dataset_entry_v0_1",
  "status": "rdkit_ok"
}
