{
  "anchor_atoms": [
    14,
    20,
    31
  ],
  "complex_id": "2hyy",
  "dataset_id": "rgroup_smoke_plus",
  "dataset_version": "v1",
  "descriptors": {
    "heavy_atom_molecular_weight": 462.36700000000036,
    "logp": 1.3297000000000048,
    "molecular_weight": 519.8230000000004,
    "num_atoms": 37,
    "num_heavy_atoms": 37,
    "qed": 0.2680520087165623,
    "rotatable_bonds": 8,
    "tpsa": 86.86
  },
  "editable_atoms": [
    32,
    35,
    36
  ],
  "editable_smiles": null,
  "entry_path": "data/datasets/rgroup_smoke_plus/entries/2hyy/entry.json",
  "has_conformer": true,
  "ligand_path": "data/datasets/rgroup_smoke_plus/raw/2hyy/2hyy_ligand.pdb",
  "ligand_smiles": "CC1CCC(NC(O)C2CCC(CN3CCN(C)CC3)CC2)CC1NC1NCCC(C2CCCNC2)N1",
  "protein_path": "data/datasets/rgroup_smoke_plus/raw/2hyy/2hyy_protein_clean.pdb",
  "provenance": {
    "entry_collection_path": "data/datasets/rgroup_smoke_plus/entries/index.jsonl",
    "layout_version": "dataset_entries_v1",
    "migration": {
      "date": "2026-06-04",
      "note": "Moved canonical dataset records from top-level processed JSONL into dataset-scoped entries/index.jsonl and per-sample entry.json files.",
      "type": "data_layout_migration"
    }
  },
  "sample_id": "2hyy",
  "sample_quality": {
    "evaluable_for_repair": true,
    "exclusion_reasons": [],
    "min_protein_ligand_distance": 2.722751916719553,
    "protein_ligand_clash_count": 0,
    "protein_ligand_overlap": false
  },
  "scaffold_atoms": [
    0,
    1,
    2,
    3,
    4,
    5,
    6,
    7,
    8,
    9,
    10,
    11,
    12,
    13,
    14,
    15,
    16,
    17,
    18,
    19,
    20,
    21,
    22,
    23,
    24,
    25,
    26,
    27,
    28,
    29,
    30,
    31,
    33,
    34
  ],
  "scaffold_smiles": "C1CC(NCC2CCC(CN3CCNCC3)CC2)CC(NC2NCCC(C3CCCNC3)N2)C1",
  "schema_path": "schemas/data/datasets/entries/dataset_entry_v0_1.json",
  "schema_version": "dataset_entry_v0_1",
  "status": "rdkit_ok"
}
