{
  "anchor_atoms": [
    3,
    4,
    5,
    22
  ],
  "complex_id": "4erw",
  "dataset_id": "rgroup_smoke_plus",
  "dataset_version": "v1",
  "descriptors": {
    "heavy_atom_molecular_weight": 440.33300000000025,
    "logp": 1.9516000000000016,
    "molecular_weight": 486.70100000000036,
    "num_atoms": 35,
    "num_heavy_atoms": 35,
    "qed": 0.5512778228454727,
    "rotatable_bonds": 2,
    "tpsa": 69.23
  },
  "editable_atoms": [
    6,
    23,
    31,
    32,
    33,
    34
  ],
  "editable_smiles": null,
  "entry_path": "data/datasets/rgroup_smoke_plus/entries/4erw/entry.json",
  "has_conformer": true,
  "ligand_path": "data/datasets/rgroup_smoke_plus/raw/4erw/4erw_ligand.pdb",
  "ligand_smiles": "CN[C@@H]1C[C@H]2O[C@@](C)([C@@H]1OC)N1C3CCCCC3C3C4CNC(O)C4C4C5CCCCC5N2C4C31",
  "protein_path": "data/datasets/rgroup_smoke_plus/raw/4erw/4erw_protein_clean.pdb",
  "provenance": {
    "entry_collection_path": "data/datasets/rgroup_smoke_plus/entries/index.jsonl",
    "layout_version": "dataset_entries_v1",
    "migration": {
      "date": "2026-06-04",
      "note": "Moved canonical dataset records from top-level processed JSONL into dataset-scoped entries/index.jsonl and per-sample entry.json files.",
      "type": "data_layout_migration"
    }
  },
  "sample_id": "4erw",
  "sample_quality": {
    "evaluable_for_repair": true,
    "exclusion_reasons": [],
    "min_protein_ligand_distance": 2.455718835697605,
    "protein_ligand_clash_count": 0,
    "protein_ligand_overlap": false
  },
  "scaffold_atoms": [
    0,
    1,
    2,
    3,
    4,
    5,
    7,
    8,
    9,
    10,
    11,
    12,
    13,
    14,
    15,
    16,
    17,
    18,
    19,
    20,
    21,
    22,
    24,
    25,
    26,
    27,
    28,
    29,
    30
  ],
  "scaffold_smiles": "C1CCC2C(C1)C1C3CNCC3C3C4CCCCC4N4C3C1N2C1CCC[C@H]4O1",
  "schema_path": "schemas/data/datasets/entries/dataset_entry_v0_1.json",
  "schema_version": "dataset_entry_v0_1",
  "status": "rdkit_ok"
}
