{
  "anchor_atoms": [
    5,
    13,
    17,
    18,
    39
  ],
  "complex_id": "1a4w",
  "dataset_id": "rgroup_smoke",
  "dataset_version": "v1",
  "descriptors": {
    "heavy_atom_molecular_weight": 574.498,
    "logp": 2.0565000000000047,
    "molecular_weight": 635.9860000000003,
    "num_atoms": 42,
    "num_heavy_atoms": 42,
    "qed": 0.0947654641917429,
    "rotatable_bonds": 15,
    "tpsa": 175.53
  },
  "editable_atoms": [
    10,
    11,
    12,
    14,
    15,
    19,
    20,
    21,
    22,
    23,
    24,
    25,
    26,
    36
  ],
  "editable_smiles": null,
  "entry_path": "data/datasets/rgroup_smoke/entries/1a4w/entry.json",
  "has_conformer": true,
  "ligand_path": "data/datasets/rgroup_smoke/raw/1a4w/1a4w_ligand.pdb",
  "ligand_smiles": "CN(C)[C@H]1CCCC2[C@H]1CCC[C@@H]2S(O)(O)N[C@@H](CCCNC(N)N)[C@H](O)N1CCCC[C@@H]1CC[C@H](O)[C@H]1NCCS1",
  "protein_path": "data/datasets/rgroup_smoke/raw/1a4w/1a4w_protein_clean.pdb",
  "provenance": {
    "entry_collection_path": "data/datasets/rgroup_smoke/entries/index.jsonl",
    "layout_version": "dataset_entries_v1",
    "migration": {
      "date": "2026-06-04",
      "note": "Moved canonical dataset records from top-level processed JSONL into dataset-scoped entries/index.jsonl and per-sample entry.json files.",
      "type": "data_layout_migration"
    }
  },
  "sample_id": "1a4w",
  "sample_quality": {
    "evaluable_for_repair": true,
    "exclusion_reasons": [],
    "min_protein_ligand_distance": 2.4937878819177857,
    "protein_ligand_clash_count": 0,
    "protein_ligand_overlap": false
  },
  "scaffold_atoms": [
    0,
    1,
    2,
    3,
    4,
    5,
    6,
    7,
    8,
    9,
    13,
    16,
    17,
    18,
    27,
    28,
    29,
    30,
    31,
    32,
    33,
    34,
    35,
    37,
    38,
    39,
    40,
    41
  ],
  "scaffold_smiles": "C1CC[C@@H]2CCC[C@H](SNCCN3CCCC[C@@H]3CCC[C@H]3NCCS3)C2C1",
  "schema_path": "schemas/data/datasets/entries/dataset_entry_v0_1.json",
  "schema_version": "dataset_entry_v0_1",
  "status": "rdkit_ok"
}
