{
  "anchor_atoms": [
    0,
    5,
    7
  ],
  "complex_id": "1hvr",
  "dataset_id": "rgroup_smoke_plus",
  "dataset_version": "v1",
  "descriptors": {
    "heavy_atom_molecular_weight": 568.4620000000003,
    "logp": 8.492700000000006,
    "molecular_weight": 641.0380000000001,
    "num_atoms": 46,
    "num_heavy_atoms": 46,
    "qed": 0.24833407105936225,
    "rotatable_bonds": 8,
    "tpsa": 67.17
  },
  "editable_atoms": [
    1,
    6,
    8
  ],
  "editable_smiles": null,
  "entry_path": "data/datasets/rgroup_smoke_plus/entries/1hvr/entry.json",
  "has_conformer": true,
  "ligand_path": "data/datasets/rgroup_smoke_plus/raw/1hvr/1hvr_ligand.pdb",
  "ligand_smiles": "OC1N(C[C@@H]2CCC3CCCCC3C2)[C@H](CC2CCCCC2)[C@H](O)[C@@H](O)[C@@H](CC2CCCCC2)N1C[C@@H]1CCC2CCCCC2C1",
  "protein_path": "data/datasets/rgroup_smoke_plus/raw/1hvr/1hvr_protein_clean.pdb",
  "provenance": {
    "entry_collection_path": "data/datasets/rgroup_smoke_plus/entries/index.jsonl",
    "layout_version": "dataset_entries_v1",
    "migration": {
      "date": "2026-06-04",
      "note": "Moved canonical dataset records from top-level processed JSONL into dataset-scoped entries/index.jsonl and per-sample entry.json files.",
      "type": "data_layout_migration"
    }
  },
  "sample_id": "1hvr",
  "sample_quality": {
    "evaluable_for_repair": true,
    "exclusion_reasons": [],
    "min_protein_ligand_distance": 2.209447668536188,
    "protein_ligand_clash_count": 0,
    "protein_ligand_overlap": false
  },
  "scaffold_atoms": [
    0,
    2,
    3,
    4,
    5,
    7,
    9,
    10,
    11,
    12,
    13,
    14,
    15,
    16,
    17,
    18,
    19,
    20,
    21,
    22,
    23,
    24,
    25,
    26,
    27,
    28,
    29,
    30,
    31,
    32,
    33,
    34,
    35,
    36,
    37,
    38,
    39,
    40,
    41,
    42,
    43,
    44,
    45
  ],
  "scaffold_smiles": "C1CCC(C[C@@H]2CC[C@@H](CC3CCCCC3)N(C[C@@H]3CCC4CCCCC4C3)CN2C[C@@H]2CCC3CCCCC3C2)CC1",
  "schema_path": "schemas/data/datasets/entries/dataset_entry_v0_1.json",
  "schema_version": "dataset_entry_v0_1",
  "status": "rdkit_ok"
}
