{
  "anchor_atoms": [
    18
  ],
  "complex_id": "4dli",
  "dataset_id": "rgroup_smoke_plus",
  "dataset_version": "v1",
  "descriptors": {
    "heavy_atom_molecular_weight": 260.215,
    "logp": 1.6596999999999997,
    "molecular_weight": 292.47099999999995,
    "num_atoms": 21,
    "num_heavy_atoms": 21,
    "qed": 0.638802874061747,
    "rotatable_bonds": 3,
    "tpsa": 62.11
  },
  "editable_atoms": [
    6
  ],
  "editable_smiles": null,
  "entry_path": "data/datasets/rgroup_smoke_plus/entries/4dli/entry.json",
  "has_conformer": true,
  "ligand_path": "data/datasets/rgroup_smoke_plus/raw/4dli/4dli_ligand.pdb",
  "ligand_smiles": "NC1CC[C@@H]2C(C1)N[C@@H](C1CCCCC1)NC2NC1CC1",
  "protein_path": "data/datasets/rgroup_smoke_plus/raw/4dli/4dli_protein_clean.pdb",
  "provenance": {
    "entry_collection_path": "data/datasets/rgroup_smoke_plus/entries/index.jsonl",
    "layout_version": "dataset_entries_v1",
    "migration": {
      "date": "2026-06-04",
      "note": "Moved canonical dataset records from top-level processed JSONL into dataset-scoped entries/index.jsonl and per-sample entry.json files.",
      "type": "data_layout_migration"
    }
  },
  "sample_id": "4dli",
  "sample_quality": {
    "evaluable_for_repair": true,
    "exclusion_reasons": [],
    "min_protein_ligand_distance": 2.962434134288896,
    "protein_ligand_clash_count": 0,
    "protein_ligand_overlap": false
  },
  "scaffold_atoms": [
    0,
    1,
    2,
    3,
    4,
    5,
    7,
    8,
    9,
    10,
    11,
    12,
    13,
    14,
    15,
    16,
    17,
    18,
    19,
    20
  ],
  "scaffold_smiles": "C1CCC([C@@H]2NC3CCCC[C@H]3C(NC3CC3)N2)CC1",
  "schema_path": "schemas/data/datasets/entries/dataset_entry_v0_1.json",
  "schema_version": "dataset_entry_v0_1",
  "status": "rdkit_ok"
}
