{
  "anchor_atoms": [
    2,
    10,
    24
  ],
  "complex_id": "2br1",
  "dataset_id": "rgroup_smoke_plus",
  "dataset_version": "v1",
  "descriptors": {
    "heavy_atom_molecular_weight": 370.2590000000002,
    "logp": 1.4124000000000019,
    "molecular_weight": 411.5870000000003,
    "num_atoms": 29,
    "num_heavy_atoms": 29,
    "qed": 0.5041392999261992,
    "rotatable_bonds": 7,
    "tpsa": 84.01
  },
  "editable_atoms": [
    0,
    1,
    11,
    12,
    13,
    14,
    25,
    26
  ],
  "editable_smiles": null,
  "entry_path": "data/datasets/rgroup_smoke_plus/entries/2br1/entry.json",
  "has_conformer": true,
  "ligand_path": "data/datasets/rgroup_smoke_plus/raw/2br1/2br1_ligand.pdb",
  "ligand_smiles": "COC1CCC([C@@H]2OC3NCNC(NCCO)[C@@H]3[C@H]2[C@H]2CC[C@@H](OC)CC2)CC1",
  "protein_path": "data/datasets/rgroup_smoke_plus/raw/2br1/2br1_protein_clean.pdb",
  "provenance": {
    "entry_collection_path": "data/datasets/rgroup_smoke_plus/entries/index.jsonl",
    "layout_version": "dataset_entries_v1",
    "migration": {
      "date": "2026-06-04",
      "note": "Moved canonical dataset records from top-level processed JSONL into dataset-scoped entries/index.jsonl and per-sample entry.json files.",
      "type": "data_layout_migration"
    }
  },
  "sample_id": "2br1",
  "sample_quality": {
    "evaluable_for_repair": true,
    "exclusion_reasons": [],
    "min_protein_ligand_distance": 3.0003196496373516,
    "protein_ligand_clash_count": 0,
    "protein_ligand_overlap": false
  },
  "scaffold_atoms": [
    2,
    3,
    4,
    5,
    6,
    7,
    8,
    9,
    10,
    15,
    16,
    17,
    18,
    19,
    20,
    21,
    22,
    23,
    24,
    27,
    28
  ],
  "scaffold_smiles": "C1CCC([C@@H]2[C@H]3CNCNC3O[C@H]2C2CCCCC2)CC1",
  "schema_path": "schemas/data/datasets/entries/dataset_entry_v0_1.json",
  "schema_version": "dataset_entry_v0_1",
  "status": "rdkit_ok"
}
