{
  "anchor_atoms": [
    2,
    13,
    20
  ],
  "complex_id": "3ert",
  "dataset_id": "rgroup_smoke_plus",
  "dataset_version": "v1",
  "descriptors": {
    "heavy_atom_molecular_weight": 358.2910000000001,
    "logp": 5.897200000000006,
    "molecular_weight": 407.68300000000033,
    "num_atoms": 29,
    "num_heavy_atoms": 29,
    "qed": 0.5165246501219026,
    "rotatable_bonds": 9,
    "tpsa": 32.7
  },
  "editable_atoms": [
    0,
    1,
    14,
    21,
    22,
    23,
    24,
    25,
    26
  ],
  "editable_smiles": null,
  "entry_path": "data/datasets/rgroup_smoke_plus/entries/3ert/entry.json",
  "has_conformer": true,
  "ligand_path": "data/datasets/rgroup_smoke_plus/raw/3ert/3ert_ligand.pdb",
  "ligand_smiles": "CCC(C1CCCCC1)C(C1CCC(O)CC1)C1CCC(OCCN(C)C)CC1",
  "protein_path": "data/datasets/rgroup_smoke_plus/raw/3ert/3ert_protein_clean.pdb",
  "provenance": {
    "entry_collection_path": "data/datasets/rgroup_smoke_plus/entries/index.jsonl",
    "layout_version": "dataset_entries_v1",
    "migration": {
      "date": "2026-06-04",
      "note": "Moved canonical dataset records from top-level processed JSONL into dataset-scoped entries/index.jsonl and per-sample entry.json files.",
      "type": "data_layout_migration"
    }
  },
  "sample_id": "3ert",
  "sample_quality": {
    "evaluable_for_repair": true,
    "exclusion_reasons": [],
    "min_protein_ligand_distance": 2.420894256261516,
    "protein_ligand_clash_count": 0,
    "protein_ligand_overlap": false
  },
  "scaffold_atoms": [
    2,
    3,
    4,
    5,
    6,
    7,
    8,
    9,
    10,
    11,
    12,
    13,
    15,
    16,
    17,
    18,
    19,
    20,
    27,
    28
  ],
  "scaffold_smiles": "C1CCC(CC(C2CCCCC2)C2CCCCC2)CC1",
  "schema_path": "schemas/data/datasets/entries/dataset_entry_v0_1.json",
  "schema_version": "dataset_entry_v0_1",
  "status": "rdkit_ok"
}
